<!--
  ~ Copyright 2017 - 2023 the original author or authors.
  ~
  ~ This program is free software: you can redistribute it and/or modify
  ~ it under the terms of the GNU General Public License as published by
  ~ the Free Software Foundation, either version 3 of the License, or
  ~ (at your option) any later version.
  ~
  ~ This program is distributed in the hope that it will be useful,
  ~ but WITHOUT ANY WARRANTY; without even the implied warranty of
  ~ MERCHANTABILITY or FITNESS FOR A PARTICULAR PURPOSE.  See the
  ~ GNU General Public License for more details.
  ~
  ~ You should have received a copy of the GNU General Public License
  ~ along with this program.  If not, see [http://www.gnu.org/licenses/]
  -->

<layers xmlns="http://www.springframework.org/schema/boot/layers"
    xmlns:xsi="http://www.w3.org/2001/XMLSchema-instance"
    xsi:schemaLocation="http://www.springframework.org/schema/boot/layers
					  layers.xsd">
  <application>
    <into layer="my-resources">
      <include>META-INF/resources/**</include>
      <exclude>*.properties</exclude>
    </into>
    <into layer="configuration">
      <include>**/application*.*</include>
    </into>
    <into layer="application" />
  </application>
  <dependencies>
    <into layer="snapshot-dependencies">
      <include>*:*:*-SNAPSHOT</include>
      <excludeModuleDependencies />
    </into>
    <into layer="application">
      <includeModuleDependencies />
    </into>
    <into layer="my-deps">
      <include>com.acme:*</include>
    </into>
    <into layer="my-dependencies-name" />
  </dependencies>
  <layerOrder>
    <layer>my-deps</layer>
    <layer>my-dependencies-name</layer>
    <layer>snapshot-dependencies</layer>
    <layer>my-resources</layer>
    <layer>configuration</layer>
    <layer>application</layer>
  </layerOrder>
</layers>